{
  "manifestVersion": "1.0",
  "createdAt": "2026-08-18T00:00:00Z",
  "source": {
    "delivery-mode": "source-linked",
    "local-path-resolution": "The local canonical source path is resolved per machine and is not stored in the committed manifest.",
    "guide-checksum": "sha256:2ee3e50945a987b07ef3fba2fa345621a47f0cfcaa42cd02843bd63be17d7ca0",
    "skill-checksum": "sha256:2448934c76467fb9f33a597169138eea7585b0e5c1d0f567e18fbb87be4f7fd3",
    "git": {
      "status": "recorded",
      "worktree": "clean",
      "commit": "ec90087ddd57024c08a94027152d0559a656564d"
    },
    "readOnly": true
  },
  "selectedClient": "Claude",
  "clientSelection": {
    "route": "autodiscovery",
    "candidatesDisplayed": [],
    "selected": ["Claude"],
    "notSelected": ["Kiro", "Codex"]
  },
  "environment": {
    "os": "Darwin 22.6.0 (macOS)",
    "shell": "zsh",
    "symlinksSupported": true,
    "symlinkDetermination": "capability-detected",
    "isGitRepository": true
  },
  "entries": [
    {
      "path": ".claude/skills/specboot-adopt",
      "source": {
        "canonicalPath": "ai-specs/skills/specboot-adopt",
        "channel": "source-linked"
      },
      "checksum": "sha256:2448934c76467fb9f33a597169138eea7585b0e5c1d0f567e18fbb87be4f7fd3",
      "ownership": "bootstrap-created",
      "mode": "symlink",
      "intended-permanent-replacement": null,
      "cleanup-status": "removed",
      "final-disposition": "Unlinked at ADOPT-18, 2026-08-19. Never followed. Machine-local entry; absence is the ordinary state on every machine but the one that ran ADOPT-00.",
      "machineLocal": true
    },
    {
      "path": ".claude/CLAUDE.md",
      "source": {
        "canonicalPath": "specboot-adoption/bootstrap-kit/discovery/claude.md",
        "channel": "source-linked"
      },
      "checksum": "sha256:b25e5f4b5398ecca0397ce4a61d43d4b0debaec69182c16f81138a008c289024",
      "ownership": "bootstrap-created",
      "mode": "real-file",
      "intended-permanent-replacement": null,
      "cleanup-status": "retained-with-reason",
      "final-disposition": "Deviation from the literal 'real-file -> remove' disposition, operator-approved at ADOPT-18, 2026-08-19: the entry's checksum reflects the file's content exactly as ADOPT-00 created it (the SPECBOOT-BOOTSTRAP delimited block, and nothing else, was the entire file at bootstrap time). ADOPT-05 (already checkpointed, commit 3ea53de) subsequently appended a permanent, non-bootstrap CODEGRAPH_START/END block into this same file. A literal full-file removal per the recorded 'real-file' mode would have destroyed that already-checkpointed permanent content. Resolved by removing only the delimited <!-- SPECBOOT-BOOTSTRAP:BEGIN/END --> block, byte-preserving the rest of the file (the CodeGraph block) unchanged — the same outcome 'appended-block' mode would have produced, applied here because it matches the file's actual current structure rather than its recorded mode label. The file itself is retained (not removed) because it now holds only non-bootstrap content.",
      "machineLocal": false
    }
  ],
  "modeObligations": {
    "payload": "SKIPPED — source-linked mode",
    "container": "SKIPPED — source-linked mode"
  }
}
